{
  "$schema": "https://json-schema.org/draft/2020-12/schema",
  "$id": "https://shanhaiedu.local/contracts/sse-event.schema.json",
  "title": "SseEventEnvelope",
  "type": "object",
  "additionalProperties": false,
  "required": ["event_id", "sequence_no", "event_type", "occurred_at", "resource", "payload"],
  "properties": {
    "event_id": {"type": "string", "format": "uuid"},
    "sequence_no": {"type": "integer", "minimum": 1},
    "event_type": {
      "type": "string",
      "pattern": "^[a-z][a-z0-9_]*(\\.[a-z][a-z0-9_]*)+$"
    },
    "occurred_at": {"type": "string", "format": "date-time"},
    "project_id": {"type": ["string", "null"], "format": "uuid"},
    "resource": {
      "type": "object",
      "additionalProperties": false,
      "required": ["type", "id"],
      "properties": {
        "type": {"type": "string", "minLength": 1},
        "id": {"type": "string", "format": "uuid"}
      }
    },
    "payload": {"type": "object", "additionalProperties": true},
    "request_id": {"type": ["string", "null"]}
  }
}
